{
  "$schema": "../schemas/source-manifest.schema.json",
  "schema_version": 1,
  "snapshot_root": "packages/upstream",
  "sources": [
    {
      "id": "omarchy-git-config",
      "repository": "https://github.com/basecamp/omarchy",
      "release": "v4.0.4",
      "commit": "c668141e9c42b13c80c9ca4ea108e11708c5e8a5",
      "source": {
        "path": "config/git/config",
        "blob": "0f8e979785bb2a451f42cd494517d12eabcd54bf",
        "mode": "100644"
      },
      "snapshot": "packages/upstream/git/.config/git/config",
      "destination": {
        "root": "home",
        "path": ".config/git/config",
        "mode": "100644"
      },
      "transform": "none"
    },
    {
      "id": "omarchy-tmux-config",
      "repository": "https://github.com/basecamp/omarchy",
      "release": "v4.0.4",
      "commit": "c668141e9c42b13c80c9ca4ea108e11708c5e8a5",
      "source": {
        "path": "config/tmux/tmux.conf",
        "blob": "d73c42ea4efe4379ea1051a0eefbe5ef2cdb2e57",
        "mode": "100644"
      },
      "snapshot": "packages/upstream/tmux/.config/dotfiles/upstream/tmux/tmux.conf",
      "destination": {
        "root": "home",
        "path": ".config/dotfiles/upstream/tmux/tmux.conf",
        "mode": "100644"
      },
      "transform": "none"
    },
    {
      "id": "omarchy-starship-config",
      "repository": "https://github.com/basecamp/omarchy",
      "release": "v4.0.4",
      "commit": "c668141e9c42b13c80c9ca4ea108e11708c5e8a5",
      "source": {
        "path": "config/starship.toml",
        "blob": "36f15d1326a40d2693710a3a98efe52e2751cf57",
        "mode": "100644"
      },
      "snapshot": "packages/upstream/starship/.config/starship.toml",
      "destination": {
        "root": "home",
        "path": ".config/starship.toml",
        "mode": "100644"
      },
      "transform": "none"
    },
    {
      "id": "omarchy-herdr-config",
      "repository": "https://github.com/basecamp/omarchy",
      "release": "v4.0.4",
      "commit": "c668141e9c42b13c80c9ca4ea108e11708c5e8a5",
      "source": {
        "path": "config/herdr/config.toml",
        "blob": "5c9f0525ce3915a427b015215f99c26db3902761",
        "mode": "100644"
      },
      "snapshot": "packages/upstream/reference/omarchy/config/herdr/config.toml",
      "destination": {
        "root": "reference"
      },
      "transform": "none"
    },
    {
      "id": "omarchy-themed-neovim-template",
      "repository": "https://github.com/basecamp/omarchy",
      "release": "v4.0.4",
      "commit": "c668141e9c42b13c80c9ca4ea108e11708c5e8a5",
      "source": {
        "path": "default/themed/neovim.lua.tpl",
        "blob": "ad4353f73f85dfce3c367af03acd87552988a4ff",
        "mode": "100644"
      },
      "snapshot": "packages/upstream/reference/omarchy/default/themed/neovim.lua.tpl",
      "destination": {
        "root": "reference"
      },
      "transform": "none"
    },
    {
      "id": "omarchy-theme-tokyo-night-colors",
      "repository": "https://github.com/basecamp/omarchy",
      "release": "v4.0.4",
      "commit": "c668141e9c42b13c80c9ca4ea108e11708c5e8a5",
      "source": {
        "path": "themes/tokyo-night/colors.toml",
        "blob": "58e6785259b83a72a5921e2cfec4c66192860b7e",
        "mode": "100644"
      },
      "snapshot": "packages/upstream/reference/omarchy/themes/tokyo-night/colors.toml",
      "destination": {
        "root": "reference"
      },
      "transform": "none"
    },
    {
      "id": "omarchy-theme-tokyo-night-neovim",
      "repository": "https://github.com/basecamp/omarchy",
      "release": "v4.0.4",
      "commit": "c668141e9c42b13c80c9ca4ea108e11708c5e8a5",
      "source": {
        "path": "themes/tokyo-night/neovim.lua",
        "blob": "39327c9b4ce88ceff70f3f3e90c9525b78801940",
        "mode": "100644"
      },
      "snapshot": "packages/upstream/reference/omarchy/themes/tokyo-night/neovim.lua",
      "destination": {
        "root": "reference"
      },
      "transform": "none"
    },
    {
      "id": "omarchy-theme-everforest-colors",
      "repository": "https://github.com/basecamp/omarchy",
      "release": "v4.0.4",
      "commit": "c668141e9c42b13c80c9ca4ea108e11708c5e8a5",
      "source": {
        "path": "themes/everforest/colors.toml",
        "blob": "a27781288ffb4889220799dff380d6f32c7b7b62",
        "mode": "100644"
      },
      "snapshot": "packages/upstream/reference/omarchy/themes/everforest/colors.toml",
      "destination": {
        "root": "reference"
      },
      "transform": "none"
    },
    {
      "id": "omarchy-theme-everforest-neovim",
      "repository": "https://github.com/basecamp/omarchy",
      "release": "v4.0.4",
      "commit": "c668141e9c42b13c80c9ca4ea108e11708c5e8a5",
      "source": {
        "path": "themes/everforest/neovim.lua",
        "blob": "80551c7801fcdb0202a030356bacb227c98d09ee",
        "mode": "100644"
      },
      "snapshot": "packages/upstream/reference/omarchy/themes/everforest/neovim.lua",
      "destination": {
        "root": "reference"
      },
      "transform": "none"
    },
    {
      "id": "omarchy-theme-catppuccin-colors",
      "repository": "https://github.com/basecamp/omarchy",
      "release": "v4.0.4",
      "commit": "c668141e9c42b13c80c9ca4ea108e11708c5e8a5",
      "source": {
        "path": "themes/catppuccin/colors.toml",
        "blob": "ee62f932c937df09e57cf748c176922f29389416",
        "mode": "100644"
      },
      "snapshot": "packages/upstream/reference/omarchy/themes/catppuccin/colors.toml",
      "destination": {
        "root": "reference"
      },
      "transform": "none"
    },
    {
      "id": "omarchy-theme-catppuccin-neovim",
      "repository": "https://github.com/basecamp/omarchy",
      "release": "v4.0.4",
      "commit": "c668141e9c42b13c80c9ca4ea108e11708c5e8a5",
      "source": {
        "path": "themes/catppuccin/neovim.lua",
        "blob": "f0d503f9022fe3818788836a9ea4a3faefae6f16",
        "mode": "100644"
      },
      "snapshot": "packages/upstream/reference/omarchy/themes/catppuccin/neovim.lua",
      "destination": {
        "root": "reference"
      },
      "transform": "none"
    },
    {
      "id": "omarchy-bash-aliases",
      "repository": "https://github.com/basecamp/omarchy",
      "release": "v4.0.4",
      "commit": "c668141e9c42b13c80c9ca4ea108e11708c5e8a5",
      "source": {
        "path": "default/bash/aliases",
        "blob": "315dd230c5d51fbc6dad51a7e516d46460cedcfd",
        "mode": "100644"
      },
      "snapshot": "packages/upstream/reference/omarchy/default/bash/aliases",
      "destination": {
        "root": "reference"
      },
      "transform": "none"
    },
    {
      "id": "omarchy-bash-completions",
      "repository": "https://github.com/basecamp/omarchy",
      "release": "v4.0.4",
      "commit": "c668141e9c42b13c80c9ca4ea108e11708c5e8a5",
      "source": {
        "path": "default/bash/completions",
        "blob": "0b6934235d8c202d96329770c0d7227aa9d53c3e",
        "mode": "100644"
      },
      "snapshot": "packages/upstream/reference/omarchy/default/bash/completions",
      "destination": {
        "root": "reference"
      },
      "transform": "none"
    },
    {
      "id": "omarchy-bash-env-bootstrap",
      "repository": "https://github.com/basecamp/omarchy",
      "release": "v4.0.4",
      "commit": "c668141e9c42b13c80c9ca4ea108e11708c5e8a5",
      "source": {
        "path": "default/bash/env-bootstrap",
        "blob": "2bc6d1f3771f9c2e7def2f4f0adfe40238f0f12d",
        "mode": "100644"
      },
      "snapshot": "packages/upstream/reference/omarchy/default/bash/env-bootstrap",
      "destination": {
        "root": "reference"
      },
      "transform": "none"
    },
    {
      "id": "omarchy-bash-envs",
      "repository": "https://github.com/basecamp/omarchy",
      "release": "v4.0.4",
      "commit": "c668141e9c42b13c80c9ca4ea108e11708c5e8a5",
      "source": {
        "path": "default/bash/envs",
        "blob": "ac608cb7093bf46a89c8756acaff92ff39bfcb39",
        "mode": "100644"
      },
      "snapshot": "packages/upstream/reference/omarchy/default/bash/envs",
      "destination": {
        "root": "reference"
      },
      "transform": "none"
    },
    {
      "id": "omarchy-bash-fns-compression",
      "repository": "https://github.com/basecamp/omarchy",
      "release": "v4.0.4",
      "commit": "c668141e9c42b13c80c9ca4ea108e11708c5e8a5",
      "source": {
        "path": "default/bash/fns/compression",
        "blob": "4e8bb81431fa0a5b5c6fc92252fa9e8399250f9f",
        "mode": "100644"
      },
      "snapshot": "packages/upstream/reference/omarchy/default/bash/fns/compression",
      "destination": {
        "root": "reference"
      },
      "transform": "none"
    },
    {
      "id": "omarchy-bash-fns-drives",
      "repository": "https://github.com/basecamp/omarchy",
      "release": "v4.0.4",
      "commit": "c668141e9c42b13c80c9ca4ea108e11708c5e8a5",
      "source": {
        "path": "default/bash/fns/drives",
        "blob": "412faaba00737340bdd7f38960a5c21db3a95c19",
        "mode": "100644"
      },
      "snapshot": "packages/upstream/reference/omarchy/default/bash/fns/drives",
      "destination": {
        "root": "reference"
      },
      "transform": "none"
    },
    {
      "id": "omarchy-bash-fns-herdr",
      "repository": "https://github.com/basecamp/omarchy",
      "release": "v4.0.4",
      "commit": "c668141e9c42b13c80c9ca4ea108e11708c5e8a5",
      "source": {
        "path": "default/bash/fns/herdr",
        "blob": "3a18527bdb1c5b989bacafdac33b6113ff0dab9a",
        "mode": "100644"
      },
      "snapshot": "packages/upstream/reference/omarchy/default/bash/fns/herdr",
      "destination": {
        "root": "reference"
      },
      "transform": "none"
    },
    {
      "id": "omarchy-bash-fns-rsyncing",
      "repository": "https://github.com/basecamp/omarchy",
      "release": "v4.0.4",
      "commit": "c668141e9c42b13c80c9ca4ea108e11708c5e8a5",
      "source": {